1252573eab087e87fb2938f8651c5b0b393aca9e,METRON-2358,Wish,Fix typos in descriptions in metron analytics module,None,Trivial,100
8fa25664fdff439ba28492bf43e26788691ec84b,METRON-2348,Bug,prepare-commit broken by github api change,,Major,100
dbacbc3cae9173466de14bbc49f7e49bf45b11e0,METRON-2341,Task,[dependabot] Bump nimbus-jose-jwt from 4.41.2 to 7.9 in /metron-interface/metron-rest,,Major,100
e57a795dc0f4781a9807bb08570b2b3948b79a97,METRON-2292,Bug,[UI] Manual query can&apos;t be saved on the Alerts UI,,Minor,100
0da31ba17a522b5afb5186d819e70999c4702e77,METRON-2276,Bug,[UI] Performance: Switching back from manual filtering fires a &quot;full query&quot;,,Minor,100
b71ddceeefb4efc677f800c66ca65fae46f4a45a,METRON-2307,Task,Migrate to JUnit5,,Minor,94.0312976
83effe49b5b996af16f68b67c6e998010a51513f,METRON-2324,Bug,verify_licenses.sh and list_dependencies.sh don&apos;t properly handle maven failures,,Major,100
b8ea1e22aebdd4e228f4c278c3171c18af664de4,METRON-2322,Improvement,Add Ambari connection check to upgrade_helper script,,Major,100
19dd9b173b5fbe3c4dc1e08a5d0498a1c441c6bc,METRON-2332,Improvement,Enable Tuning of the Profiler&apos;s Parallelism from Ambari,,Major,100
9b4979d69319436af5a65fd52bc555f794aa5029,METRON-2323,Improvement,Increase unit test coverage for Alerts List,,Major,100
ebed1db10644d769f23ef7266d8365adca7c13cb,METRON-2208,Improvement,[UI] Increase unit test coverage for Alert Details,,Major,100
1ece1ed0d2ac85d3d8114c45b555a657e2521be8,METRON-2316,Improvement,[UI] Drag drop sorting for the selected fields in the Alerts UI,,Minor,100
657028bc7f69fb7b4d54fae22b3c3fcb5d88b61b,METRON-2326,Bug,Unable to Call ENRICHMENT_GET from Threat Triage Rule Reason Field,,Major,97.68912987
101d4275ce09b819b2312407e427469370f69ef8,METRON-2285,Bug,Batch Profiler Cannot Persist Data Sketches,,Major,98.1498137
fc4bf498dc39a00715ec772a3ad4f9368b532101,METRON-2321,Bug,Remove Legacy AWS Deployment Path,,Major,100
20688203662663571ac02e6d5c80394ed0c0e206,METRON-2317,Sub-task,[UI] Delete confirmation dialogue looks visually broken,,Major,100
650c6cb39ae089c9bd8d8b039cd6a67140dbf085,METRON-2304,Improvement,Update node and npm version to LTS releases,,Major,100
97d7e46f53376303e18540075b0aa53198b0a1cb,METRON-2311,Bug,Remove JUnit from all our uber jars,,Major,100
fca9ebf0dc945bea485be334e4fcfcbe7ed179cf,METRON-2239,Improvement,Metron Automated backup and restore,,Blocker,100
12e16df4c340be169ff0d0190c732948fdcd2e44,METRON-2308,Bug,Fix &apos;Degrees&apos; Example Profile,,Major,100
604a106f74ba0d2151e805b261f04b91a14fa2f6,METRON-2310,Bug,Remove metron-integration-test from compile dependencies,,Major,100
8686f5265e68a5fb861f944b4b3b086c807618f2,METRON-2284,Bug,Metron Profiler for Spark doesn&apos;t work as expected,,Major,100
fb3986e3ec6c39838fec2cf96020d84dd2ff86bc,METRON-2290,Bug,[UI] Delaying first auto polling request on app start,,Major,100
6c064b76e2252776cde64280b9ee15091339cf5a,METRON-2293,Bug,Fix some inaccuracies in the MaaS README example,,Major,100
eb1dda62eccc5f6e9ae402d743b11564b4506ba5,METRON-2302,Bug,[UI] Change the default polling interval for Alerts UI to longer time,,Major,100
df6e18154c508cd803095d31f8ff9cf96e05406b,METRON-2295,Improvement,[UI] Displaying &quot;No Data&quot; message in the Alerts UI screen,,Minor,100
581a43f870de3940cadd9cf8170d43a598f89640,METRON-2294,Improvement,[UI] Fixing Stale mode issue in Alert UI Manual Query Mode,,Minor,100
d0d64d4ad227711b3cf842bca2965087ed191f59,METRON-2291,Bug,[UI] Fixing and rephrasing warning messages on Alerts UI,,Minor,100
37a8e2e8211dd2c8a56c8e75b516e3029c421099,METRON-2303,Bug,Change Default HDFS Port for Batch Profiler,,Major,100
e645ffe34a98617b91261738477358c760bb60cf,METRON-2300,Task,Fix Brad Kolarov&apos;s Apache ID,,Major,100
67b4d0b2c84f7f370890c1caf639459a4c40b37a,METRON-2280,Bug,PCAP queries no longer work,,Major,100
bb9a244d81feb54bc93456310f57a92d63cea38f,METRON-2259,Bug,[UI] Hide Resolved and Hide Dismissed toggles not works when filtering is in manual mode,,Major,100
50b5c50d93db92ff0d13de7d640187b614fd5de6,METRON-2278,Improvement,&quot;Metron on CentOS 6&quot; Documentation is outdated,,Minor,100
895fe493f38fd85abd3e0f14df507293b977ccfe,METRON-2274,Bug,Flatfile loader and summarizer mapreduce mode broken,,Major,100
03e0977ffa0815f129fcb5a1340f6a2b2f0212c6,METRON-2272,Bug,[UI] Performance: Switching manual filtering on and off multiple times leads slow typing,,Major,100
d693e282342afb8e67a57744ee3505262295dd35,METRON-2190,Bug,[UI] Alerts UI: Indicating loading and preventing parallel requests,,Major,100
080e074e9d3861f102e74a46a30f6b90ac2da1c9,METRON-2271,Improvement,Reorganize Travis Build,,Major,100
eaee9f84f27c9fcf35cf2b0492352016b5b88b76,METRON-2266,Improvement,REST debug instructions,,Major,100
3a666d5d8d6489882bcc32ded5f53bb5225c3ab1,METRON-2235,Bug,Full dev deployment server startup timeout,,Minor,100
92220ced649b14d90fd7bc27b66a3d2eca651475,METRON-2257,Bug,Metron-Alerts GUI testing failing on MacOS builds,,Minor,100
0e2eadf7dc7aa9db3e77f97b43c5846625162059,METRON-2247,Improvement,rpm-docker: Provide an option to bypass running rpmlint,,Minor,100
b1536d73fd33707357f0b0274443d63f9487454c,METRON-2254,Bug,Intermittent Test Failure in RestFunctionsIntegrationTest,,Major,100
722eb66a6a6a1208185e238f29864d95c673f404,METRON-2211,Improvement,[UI] Alerts UI should optionally render timestamp in local time,,Major,100
c402e6442d8d699eef5aa5464cd91347160b082c,METRON-2217,Improvement,Migrate current HBase client from HTableInterface to Table,,Major,99.78509066
3b96474ee3b82e9d254b466d5997321b90a6f8c5,METRON-2201,Bug,The description for the IS_IP method default behavior needs to corrected as per implementation ,,Minor,100
67fa5a403b01d0f7c8607c06e63f9d06f8b8cbc1,METRON-2227,Bug,Kafka test harness has a hardcoded 5 second timeout,,Minor,100
5eed6663f2689e160be0a525c8e423961cd2269f,METRON-2221,Bug,Notebook import fails through Zeppelin REST API,,Major,100
edc449ffa6be51749f6a3b100bf6a0a33755e50c,METRON-2243,Improvement,[UI] Update npm dependencies to resolve audit warnings,,Major,100
888c4bc8f353ea0424f28919ab33b5f4ad861d25,METRON-2199,Improvement,[UI] Add ability to turn off query building in Alerts UI search input,,Major,100
1a6d77fd74e37950ced4ae1620d9ee9d80cdc4b1,METRON-2238,Bug,Streaming enrichments regression,,Major,100
e6ca3c71d8120516afcf816be2cda81093088b72,METRON-2149,Bug,Shaded jar classifier is not consistent,,Major,100
4ab1fdba2f93cfb90dea55d315fb7f45c63d2fa6,METRON-2179,Bug,[UI] Make navigation in both UIs consistent,,Major,100
7219606fd56258c3037c73e5709f2144702fe37a,METRON-2212,Improvement,Add debugging developer docs to hbase-server README,,Major,100
5e93677d38889fdd34d4f6a93ab0e8099bf01c7b,METRON-2076,Bug,Stellar timezone test failure,,Minor,100
88f4d2cefe4bbb389732da3b4f5cbcf02b7b949a,METRON-614,Bug,Eliminate use of the default Charset,,Minor,99.72903401
f6054a46d6ba56396e61f26eeeb08ec47a40a498,METRON-614,Bug,Eliminate use of the default Charset,,Minor,100
3bea6adfd44ac7d4b04f42c38ccd46ab5796dab1,METRON-2205,Bug,Cease querying on filter or time-range change,,Major,100
771d66b5a806f9c0f1c53c1782977e00fa26917a,METRON-2195,Improvement,Add defensive log level checks when constructing logs is expensive,,Critical,99.4259158
0239432b967bc176d20d6965544be582f54ae0e9,METRON-2202,Bug,Add parameter validation for the stellar field validation functions,,Major,100
8c4b53dae73067e05cfcdac42ceb9c562bf4c2fd,METRON-2197,Improvement,Add debugging info output for Solr queries,,Major,100
340827f2569767056698ac38cf4517dc866c4e06,METRON-2189,Task,Optimize imports in mpack python scripts,,Major,100
855de4a21ceb33bb608d7eb8100397eae294d81a,METRON-2194,Improvement,Update Ambari tooltip to specify single quotes for parser names with hyphens,,Major,100
8a5e7e7d348922477faf1717b8556d81e950b762,METRON-2192,Bug,[UI] &quot;All time&quot; time range is broken on Alerts UI,,Major,100
625653513849e4e848b96582d920fb193a4c961f,METRON-2191,Bug,[UI] Checkbox selector on Alerts UI is broken,,Major,100
6306c935d71150456c2adbd0702001ae6b88fe38,METRON-2130,Bug,[UI] Numeric steppers on the Management UI seems broken,,Minor,100
65681a0a0888576725663347e52deafe8ca94a1a,METRON-2129,Bug,[UI] Clearing the search bar resets alert filter range to &apos;All Time&apos;,,Minor,100
5e1e3bd2e2876a6774b9c50d72115332f0bc15ee,METRON-2140,Bug,[UI] Implement logic behind show/hide RESOLVE and DISMISS items in Alerts UI,,Major,100
ed63eac260e442f8c6f17dd93f6d87fc946cae0d,METRON-2172,Bug,Solr Updates Not Tested in Integration Test,,Major,99.59178119
43f74fc91a24ea2b24f5a41038cdf46d3d883fa1,METRON-2185,Bug,Update Simple-Syslog dependency to fix error in Structured Data,,Major,100
7e39143caf841fdb576caa417ce33110ba123270,METRON-2079,Bug,Fix documentation for installing Ansible for fulldev Centos 6,,Major,100
753e8ea6693abfe762fc5f7d186bde8d71609fc4,METRON-2174,Bug,[UI] Grouped alerts total can differ from search alerts total,,Major,100
b516a75417a01b080462acdcf61b7101f8e67d0d,METRON-2161,Bug,[UI] CSS positioning bugs in Alerts and MGMT UI,,Major,100
5425f8f97a7d3620d7dd2e0a9d26f692b58963fb,METRON-2183,Improvement,Update to Angular v7,,Major,100
f36bba7c0ed6a2cff3f30de73d7e2650e03681a6,/,/,    Metron-2180 IS_DATE stellar function is lenient while parsing date/time (MohanDV) closes apache/metron#1461,/,/,100
42ce5add9ae5b20bb3667e81e8aaa148f48a4d42,METRON-2148,New Feature,Stellar REST POST function,,Major,99.97298757
891ebd5ce4391bcf3260cff3db20f08d27ea21fa,METRON-2150,Bug,[UI] User not able to filter by multiple values of the same field on Alerts UI,,Major,100
bf673a2e9c00a59716e70feea55d581af91145f1,METRON-2168,Bug,Elasticsearch Updates Not Tested in Integration Test,,Major,98.59310345
c8f2c9affd8e3b2ed9b99cf7eb9ac7b61e4d37a2,METRON-2084,Improvement,Add documentation notice for MacOS Mojave users for new security permissions,,Major,100
87928824509c5f6ab314375be720dd64d8361cf4,METRON-2061,Bug,Solr documents with date fields cannot be updated with Dao classes,,Major,99.85891648
02f88a313068a876e20227a2347cedafb4cec0ae,METRON-2164,Bug,Remove the Split-Join Enrichment Topology,,Major,97.92775939
c9604c255aa596202c6fb348fca3aa9816c0b297,METRON-2166,Bug,FileFilterUtilTest.test_getPaths_leftEdge:116 expected:&lt;1&gt; but was:&lt;2&gt;,,Major,100
f2f3bb4877b02ce40e9712a9bd0c91f6e4d40d75,METRON-2155,Bug,Cache Maven in Travis CI Builds,,Major,100
a2a46e6567c78e5066c0d3360d7838d1a5851fa7,METRON-2156,Improvement,Remove Storm dependency from metron-hbase,,Major,98.64964039
09bbdf30e1ecef88b67755d12d407a39ce44536c,METRON-2142,Bug,Install solar schema as metron user,,Major,100
ee1b2c34d329a4fffbb6e900fe06112eda7bc8cd,METRON-1253,Bug,Manual pasting of timestamps into the timestamp picker,,Major,100
38b8a7824a3ceed829215c8ce4ecad963ebf449e,METRON-2073,Improvement,Create in-memory use case for enrichment with map type and flatfile summarizer,,Major,99.76435935
9621ec7dbd740e0fe37d12f283b4e7a7e0f0178f,METRON-2092,Bug,[UI] Config UI does not require you to set a grok timestamp field by default,,Minor,100
3c1317360243398eef8097edcea5f7c1a0bb2f59,METRON-2141,Improvement,Cache REST API status update calls to the Storm UI,,Major,99.83749446
5bd7e010c2f389c2c14476337df982f2e781af8d,METRON-2102,Sub-task,[UI] Adding click-through navigation to Alerts table,,Major,100
a1487ec104c0ebb7e3383499b445726dbe5de142,METRON-2153,Bug,ParserIntegrationTest should print failed messages,,Major,100
e16ff316ae1a05f88a1f515ba2040d6cddab1d3f,METRON-2127,Task,Update Maven repositories to https,,Major,100
dbf8bf9dd0f7140092ba789ff048c2f6beeb79c6,METRON-2145,Task,Clarify RPM build documentation,,Major,100
a8f2d3a2814315da950f24ec74bacc3b8f44b1f2,METRON-2083,Bug,Fix broken links in root metron README,,Major,100
2dd753e4b69fe1b85b7604a8d0e20af8ecea0ae8,METRON-2152,Improvement,Add debug logging for when sensor batchTimeout exceeds the calculated maximum,,Major,100
3754ff33f6cd149ffca57474d744e0298d4c172a,METRON-2112,Bug,Normalize parser original_string handling,,Major,100
b9a130ca96774add38865d3934ed61ca19599b87,METRON-2087,Improvement,Remove Storm dependency from metron-indexing,,Major,92.50991335
bfe662d6e7b07f8340067d7aaeb976068617b6b1,METRON-2128,Bug,LEEF config file is missing in RPM spec file,,Major,100
ccb5bec1dd101850c18faee128bbca77af815880,METRON-2143,Bug,Travis Build Fails to Download Maven,,Major,100
9b70adf1d7f716c4a301af10c6726c40ecb1f3dc,METRON-2123,Improvement,Expand Stellar JOIN to work on all Iterables,,Major,100
373ac513b0779c9399fce299094560a0261a6590,METRON-2109,Improvement,Add option to use Metron GUID as the id in Elasticsearch,,Major,99.97081144
a6281d30ae82216dfe2c37576884a67b72e74ab7,METRON-2113,Task,Update version to 0.7.2,,Major,100
3b0446006c327b7dea494b3a0bcbb9de4f662d5a,METRON-1788,Improvement,Fetch Profile Definitions from Zk for Batch Profiler,,Major,99.91235758
22cc622d6f08cfa77c06dea2df7f4c56edc1862e,METRON-2118,Bug,Parser for LEEF data,,Major,99.94150336
506c18cb5abe3a8ec1d660af9350382e085c6e15,METRON-2085,Bug,[UI] Alerts UI Details Pane: naming meta alerts is broken,,Minor,100
2653157862740fc05ce8b3a8dcf4745a9f996c23,METRON-2058,Bug,UI: Actions -&gt; Add to Alert can still be selected from dropdown when no alerts are selected.,,Major,100
b8df052fabe4e00a1a30e20f958f6e07c4fb4fef,METRON-2107,Task,Add architecture diagram item to PR checklist,,Major,100
fcd681d10256c3cc44722cff694d08649ea27673,METRON-1997,Improvement,Replace Threat Triage Score Field Slider with Text Box,,Minor,100
5a3fd55683fe7d6d35c1d7e293c9853a057a384b,METRON-2111,Task,Update public web site to point at 0.7.1 new release,,Major,100
adf477d90cf23bc757641b3e74bdb2ed9b242f04,METRON-2089,Bug,[UI] Adding loading state to Alerts details view,,Major,100
fb80e32e04f5e02ba1b10bd1a915047e42480819,METRON-1989,Bug,Tooltip for ES mpack path_data is incorrect,,Major,100
d92e0a2102306ce6d6b6b2a8c986590b030d4a88,METRON-2075,Bug,site-book generation broken on MacOS with GNU sed installed,,Minor,100
57bbab2c899877ddb114082bff111444b3089b00,METRON-2106,Bug,Escalation topic setting in Ambari has no effect,,Major,100
e1d1901395d7b135deb48c3c4af5a94ed35fbaa4,METRON-2100,Task,Update developer documentation for full dev management UI parser aggregation feature gap,,Major,100
f3f5c9743f515d8902b4580c765ad9d2b64aa63b,METRON-2018,Bug,Update prepare-commit to add Bro plugin tests,,Minor,100
4390e38c2460624734ead7ab6f9fff3738471c4e,METRON-2093,Bug,Metron RC check script is outdated,,Major,100
024aa201bc4cbe00af71c57b9e0fe27b51305030,METRON-2094,Sub-task,Create CentOS 7 Development Environment,,Major,100
f99cc54d367c1f36433f7a41e1c89e7bf75786fb,METRON-2090,Bug,Full dev is failing with missing org.mortbay.jetty:jetty-util:jar:6.1.26.hwx dependency,,Major,100
fd6bbcc4ab9862ce0891bd7570a7654dcd68ea46,METRON-2091,Bug,SimpleHBaseEnrichmentWriterTest should be included in tests,,Major,99.94146912
51d1c812c1e45f57da8c27fe37fd13797707884e,METRON-2078,Improvement,Remove Storm dependency from metron-writer,,Major,97.83537034
c453b1edf27a4a2883e4c055246d939218908ebb,METRON-2065,Bug,Setting Parser Output Topic in Sensor Config is broken,,Major,99.7761194
7f6ad42e534eeaf9423f33c3a6ea1d3d131049f5,METRON-2067,Bug,Maven pom file duplicate dependency fixes,,Major,100
b6d8cade6aec7fe6290d4fd5660ff205de06bd64,METRON-2074,Improvement,Script to handle TGT renewal with Storm and Kerberos enabled,,Major,100
c58062a263927a4c41edd0315d58077e0a91446a,METRON-2082,Bug,Update the read me document steps to run Batch profiler ,,Major,100
d6763a8fad94e7b25bdf03e7b896eb435852c8e5,METRON-2006,Bug,Reenable JacoCo code coverage,,Major,100
dc273a5be628c458ad0b25380d55536cd37b7a4f,METRON-2071,Improvement,Add MAP_PUT and MAP_MERGE to Stellar,,Major,100
3a61933ed4fb6ec00286f4c13a22c372adf8d0dc,METRON-2014,Improvement,Add architectural documentation for metron-writer,,Major,100
2f2c80244b34e8182f72e6f4dc98a2940194eaa0,METRON-2026,Improvement,Remove Storm dependency from metron-common,,Major,96.48241206
80ae71f5ebeb3c6761951a70871fee208448f3e1,METRON-2062,Bug,Metron Alerts: Accidentally commited `fdescribe` in unit tests,,Critical,100
57095488f28a017e290e021fea65412e7240e8da,METRON-2050,Improvement,Automatically populate a list of enrichments from HBase,,Major,98.71634314
46e8625865100b35ee69fe6499e8bda56197fbcd,METRON-2060,Improvement,Improving Alerts table config pane,,Major,100
8d7ce165050619abf3d8be600ba4c8655b6ad0ed,METRON-2064,Bug,Metron REST API overwriting global.json values,,Major,100
54aa46ee44a329504559f417790324c175f5af6a,METRON-2066,Bug,Documentation and logging corrections,,Major,100
64b079044f6840fc0bcb1bf9cb665790f37900f4,METRON-1654,Bug,findOne request after an alert patch returns with the original state of the alert item,,Major,100
14efe83e3a8d9ba7c2bef35061fc9829ee0e61f8,METRON-2053,Improvement,Refactor metron-enrichment to decouple Storm dependencies,,Major,90.79665917
a1c257c6a583ba705d5e551fb5e7f5c9862097ac,METRON-2022,Bug,Metron rest creates large number of connections to ZK which causes subsequent connection to zk fail,,Major,99.90248659
cf7fcaeb3cb22755cf732505a2d6fc62783d7af9,METRON-2056,Bug,Support LDAP Bind Authentication,,Major,100
cad679a5948ce0ee9866e61bbf75b1f5f255682c,METRON-2023,Improvement,[UI] Covering Grok Parser Creation with Cypress tests,,Major,100
4da899043ffdb222f8a928cd30bc0f47b99c632a,METRON-2039,Bug,Time range queries do not work with Solr,,Major,100
88d3ca8a51f7b1ee059df4f1458dbceefd090e15,METRON-2052,Improvement,[UI] Changing default query time range to 15 minutes,,Major,100
8bb7a27cd97a4d6e513f073463b9e62e96387f3d,METRON-2051,Improvement,Improve stellar-zeppelin documentation,,Major,100
2f1af5cc50ba0e5e940885a1eaf5096c40a49072,METRON-2023,Improvement,[UI] Covering Grok Parser Creation with Cypress tests,,Major,100
af28bba3a651f7a92642acd66db9b6d3a27d45d6,METRON-2046,Bug,IS_EMPTY stellar functions fails on empty map,,Major,100
17b31b48f59627a9e768a5cbe0be7ac55b5b04f8,METRON-2029,Improvement,Configure Table should have filter,,Major,100
ab9241d3df5edcd4d6ae84a72f552b0773d50954,METRON-2032,Task,Create summary table having list of stellar functions in README,,Major,100
e63faf84f1b227c44b2d6b224b89c74449bcf0cc,METRON-2038,Bug,Enrichment Loader Fails When Run as MR Job,,Major,100
ef1ce3c3d82758452fb63ca9d5cee31d266031ee,METRON-2035,Improvement,Allow User to Configure Role Names for Access Control,,Major,99.90232785
0c774ab921ff4271611bdf9d3bb7ad3978d3f7b0,METRON-2041,Bug,RegularExpressionsParser in wrong source folder,,Major,99.93483219
9c69ffc8559830096a6138a5ef8fb3c31ea5bca3,METRON-2036,Bug,Maven builds fail locally in HDFSWriterTest,,Major,100
91368e1ee3565a91a46ad8d2d3639fecce320e84,METRON-2030,Bug,SensorParserGroupControllerIntegrationTest intermittent errors,,Major,100
143901b018fff7008415e08351f32a63095b357e,METRON-2031,Bug,[UI] Turning off initial search request and polling by default on Alerts UI,,Critical,100
1ae45a97dc73ee468f6d45052fbfa63c3bca19b8,METRON-2012,Bug,Unable to Execute Stellar Functions Against HBase in the REPL,,Major,100
e781237284698812f6ce4ac5847684e7a65135b8,METRON-1971,Bug,Short timeout value in Cypress may cause build failures,,Major,100
15119cb16b30862e6fbba3662407ca4db4c59a3a,METRON-1940,Bug,Check if not and install Elastic search templates / Solr collections when indexing server is restarted,,Major,100
34a1fd513c8f27b130b6ba8edbb3d4a1ed463993,METRON-2019,Improvement,Improve Metron REST Logging,,Major,99.90215264
6d41526c3eff511e5fe11368c6f3f0a837507ba1,METRON-2016,Improvement,Parser aggregate groups should be persisted and available through REST,,Major,99.70525626
42ce88e05c60e3e2a7005e9804b2e74332951d0a,METRON-1987,Bug,Upgrade Alert UI to stable Bootstrap 4,,Major,100
2d2cec749c52659f4cf5b9177047b018222a13cd,METRON-1968,Bug,Messages are lost when a parser produces multiple messages and batch size is greater than 1,,Major,98.3757178
fec36c7ed0b2d29f4dc48574adf02c7fcb13e5fb,METRON-1778,Bug,Out-of-order timestamps may delay flush in Storm Profiler,,Major,100
cc30c0e21656fa95b488adb47a3c9fcec94af67a,METRON-1996,Bug,Solr search throws NPE for group search if the group parameter is null or empty,,Major,100
792e7962f32b8154cd501edb65fa3fb5819758dc,METRON-1944,Bug,Unable to Delete a Comment in Alerts UI,,Major,100
2fb8524ab46047aaf408691ac1d3143836371ab4,METRON-2010,Bug,Unable to Build Metron Due to Inaccessible Repository,,Major,100
d275a958cb5b7bbab533d273dff80bc1e3e65fd0,METRON-1998,Bug,Only one sensor is flushed by tick tuple,,Major,100
14dfdc69317f71388e63cd58e2064dc41f6934e5,METRON-2009,Improvement,Address Javadoc checkstyle issues in metron-common,,Minor,97.94995964
5e9cf705ef5feb1d723f584c1b6134bcc1eda9cf,METRON-2005,Bug,Batch Writer writes 0-byte files to HDFS on rotation,,Major,99.9522749
36946ff09aadd54bebb503e89121d996f9242cc9,METRON-2007,Bug,Management UI not loading grok statements correctly,,Major,100
22834879017355fa456f42a6e71a3ed44d0b43fe,METRON-1986,Bug,Batch Profiler Fails to Resolve Stats Stellar Functions,,Major,100
4d420f4d1704b2da4e725de3fda4c08d97691611,METRON-1993,Bug,Stellar REST_GET should handle responses when content length is less than zero,,Major,100
b89f066663b651d11abdf302da034d863559ce4e,METRON-1999,Improvement,Adding validation against special characters to parser name field,,Major,100
9641aec6284102d16db2fbfd1dc5960d6767008a,METRON-1985,Improvement,Improve Error Handling When Cannot Connect to HBase,,Major,99.9363564
0cf78d223f24eaf7112bfb7fb52d8778f8a1a2fa,METRON-1974,Bug,Batch Profiler Should Handle Errant Profiles Better,,Major,99.93633615
1b6ef88c79d60022542cda7e9abbea7e720773cc,METRON-1970,Improvement,Add Metadata to Error Messages Generated During Parsing,,Major,100
8e111e8ae09516e3c13138586e9c26fabe9fc981,METRON-1995,Bug,Arrow icon in date range selector moved to a wrong position,,Minor,100
16e353b0d8c710eb64bad1188d8329d6872380e4,METRON-1973,Improvement,Upgrade Alert UI&apos;s webpack-dev-server to 3.1.14,,Major,100
01d66880d99f5f46770b0f02755f4e9d86980cf5,METRON-1948,Bug,Dropped messages from REGEX_SELECT parser field transformation are not acked in Storm,,Major,100
575d6ef09a13950377d6b0b7ba8419ab2ee7a6f9,METRON-1969,Improvement,Adding Cypress documentation to Alert UI&apos;s README.md,,Major,100
65910d9e7a720ac47a8584510ab75f59c0c9f362,METRON-1933,Bug,Improve build-utils helper scripts,,Major,100
46b4c15a0c91569cc02ed71fa5bb91f3b6e2a572,METRON-1962,Bug,Make entering JDBC details in REST config to be optional,,Major,100
f43035c02ef01f07ff382bbf136eb1bada727fbb,METRON-1929,Task,Build GET_ASN Stellar function,,Major,98.47658756
d4498e6c512aac37e734fb9e970a3f466632c95c,METRON-1956,Bug,prepare-commit does not run all the tests it should,,Major,100
2c99257c970a5e8b29157a5fe52e74769ecd3444,METRON-1965,Bug,Knox should work on a multi-node installation,,Major,100
aa85ffab39b50eeff46b47c68bc670c5e7c6a1d0,METRON-1939,Task,Update version to 0.7.1,,Major,100
39fa0f134fbf4d16da2001792971135d9f24cf4c,METRON-685,Improvement,Scores in Threat Triage should be a Stellar Statement,,Major,97.73011897
862244721fef7ba7389000cc2f3d0756bb07d69d,METRON-1963,Bug,Remove left over integration test from before refactoring,,Major,99.8630137
309ce65f863d2532ca29a1c779bda02c1d42ee4d,METRON-1945,New Feature,Metron MPack support for Knox SSO setup,,Major,100
ef69acd0d911ddde2dec17544eb1a844b7b79bee,METRON-1878,New Feature,Add Metron as a Knox service,,Major,99.77081742
74658e97a55aeac612a70689850d352d907adf96,METRON-1958,Bug,Optimize Cypress to use best practices,,Major,100
9e717a525ddca986130f4208fb6c558eaaa56eab,METRON-1957,Bug,5424 and 3164 parser configurations are packaged in wrong place,,Major,100
7089086cfc8c070a48d80b3884ad396ebb025238,METRON-1955,Bug,Update metron SPEC file to include syslog 3164 parser,,Major,100
0dc9fc8fe862c6a43f25bf9c61bbd38a36d3bbc8,METRON-1893,Sub-task,Create a syslog 3164 parser,,Major,99.61732741
8c1171fa5bcc1c4a015d9160b626f452c1533330,METRON-1954,Bug,Commit Script Fails to Extract Usernames with Numerals,,Minor,100
d1b534f31afc2f241d5ea656eeab5268cc39b84b,METRON-1953,Bug,Stellar REPL Fails on Start,,Major,100
adbe94530e0783aeee976e765e3e57c0907c2854,METRON-1941,Bug,Alert Escalation Not Consistent in Alerts UI,,Minor,100
7f073b863c5ab5a420b34f83f27297a7674640bf,METRON-1951,Improvement,Add site-book generation to Travis build,,Major,100
74ec7fedd48135123092b2a638ed1f2e2f57530c,METRON-1934,Improvement,Stellar should built without error prone messages,,Major,100
9e026e3e902769dae364b4c4acf64e00839d24f5,METRON-1950,Bug,Site-book generation broken in master,,Major,100
d8bd35d192e1a141ea2773dae40c58b3b60a7802,METRON-1936,Bug,Cypress fails when trying to parse double quotes,,Major,100
d7d4fd9afb19e2bd2e66babb7e1514a19eae07d0,METRON-1815,Improvement,Separate metron-parsers into metron-parsers-common and metron-parsers-storm,,Major,91.17464264
e4d793a55a56a01fa101c8da77d92f99325ba539,METRON-1932,Improvement,Update ES and Kibana to 5.6.14,,Major,100
ec118557cb6a9bfe91528702c7bf093977fa80d7,METRON-1938,Improvement,Add Parser Debugger to READMEs,,Minor,100
2e6caa908c0b7708281d76b6744d63706fe610b2,METRON-1925,Improvement,Provide Verbose View of Profile Results in REPL,,Major,99.10630292
b8e426c755a5969e24dba50f5d8fa81d1ccb472d,METRON-1795,New Feature,General Purpose Regex Parser,,Minor,99.92200905
90582b30902b9506d16547c0cdac16e8a7e3a66e,METRON-1892,Improvement,Parser Debugger Should Load Config From Zookeeper,,Major,99.96877927
693dab5e547d9513b6ed661aa62143c2d1e0bd1a,METRON-1937,Task,Update public web site to point at 0.7.0 new release,,Major,100
eb2aee1820cae811c6491d68aed32ccc055922e4,METRON-1879,Sub-task,Allow Elasticsearch to Auto-Generate the Document ID,,Major,99.31666408
c4f5c55e2914b6d29811942fd0f331184141f30f,METRON-1930,Bug,Update webpack-dev-server in Alerts UI,,Major,100
ec3b98f762ce3726ed9a33abdb446957d1865dca,METRON-1849,Improvement,Elasticsearch Index Write Functionality Should be Shared,,Major,98.4729292
2263983761e77b7eec52f70f5e8f8001bac83125,METRON-1928,Task,Bump Metron version to 0.7.0 for release.,,Major,100
