38742d250275529d07c1ff4f912a29b73a5985fb,CHUKWA-824,Improvement,Refine project setup,None,Major
c6e70714aba5f7403631a2d0bc2f4b28f47ee63b,/,/,    Fixed typo in the README.md.,/,/
a7c886930c6437b5617dac5aa743a8de55231687,CHUKWA-824,Improvement,Refine project setup,None,Major
5514e15861db62ec2ed9956f1984d062b2af9a20,/,/,    Merge branch 'master' of https://gitbox.apache.org/repos/asf/chukwa,/,/
140a58df0852c8f05dc6b2dc9a7e7cf60f67712d,CHUKWA-824,Improvement,Refine project setup,None,Major
65f6972859115a4ddad6def06475465f0971e9ae,/,/,    Close #9 Update README.md,/,/
8f8ef253c26ab91cba18d65b073705402600dbde,/,/,    Fixed Spelling.,/,/
1695db7d4f3118ba4a34751196a99ec2e4ea7aa0,CHUKWA-822,Bug,Update struts version to avoid security hole,None,Major
973e11e9de2b6067f2a8431599912b04db49a50a,CHUKWA-821,Bug,Chukwa Trunk fails to compile,None,Major
e90967f94cb2b5251761f45a9a61518db48677c9,/,/,    add Apache license header,/,/
337a0a9743ad01b8357dc557bb3277868f37d333,/,/,    add Apache license header to the Junit test case,/,/
ce5d76b37c5f0e4de34529c20e9fa11c684b56f4,/,/,    Add Apache license header,/,/
c9715241cfb24954f423099e94c053f7cc37ad2a,/,/,    Fix test case,/,/
322119d9884ebf49678c0ed307e946c8c05ebc9e,/,/,    Fix test case,/,/
4223cbe1ee8b903bc4df78185842bb3fc31a0b05,/,/,    Create Junit test case for caffe,/,/
d1b7ef949c7db832ae3476310a2eeab2b5103b22,/,/,    Chukwa JIRA-819,/,/
971641927fd399143329bcc0480e0f1e6b032a74,CHUKWA-817,Bug,HBaseWriter leaks connections when parser error occurs,Data Collection,Major
5bf50709d070144bf958616111efa57c6c0475a5,CHUKWA-818,Bug,SolrWriter zookeeper connection leak,Data Collection,Major
ffd0d400ebd911ffa88bb9a46b08a261bc999dd6,CHUKWA-816,Bug,A suspicious use of incrementer in a for statement,None,Trivial
384e3a13a82f37b26e9e6e8ff8c8f34d2acabe9e,CHUKWA-815,Improvement,Dashboard add widget and chart interaction are not user friendly,User Interface,Major
e0ff0ea8b6237549624f2ddc2f82c088223f8ef0,CHUKWA-814,Improvement,Update Docker demo with HBase 1.2.4 and Solr 5.5.3,Build and Test Code,Trivial
cf722856c14b6132cfb335d1b3aa36709dde14f9,CHUKWA-813,Bug,Solr can not sort by multi-valued field (date field),User Interface,Major
6276ed15c46dd08a21ae9240e4371930d5a5b2d5,CHUKWA-812,Bug,Throttle dashboard saving,User Interface,Major
fcfcc088b61a262f81876e24ecce854e13cbd6c1,CHUKWA-812,Bug,Throttle dashboard saving,User Interface,Major
20be5ae512207de60ef57d596ec0c0fe30d00743,CHUKWA-810,Task,Trademark issues on website,None,Major
3a356ddbbc4790684530ecde4d59ef3ee26d14b1,CHUKWA-809,Improvement,Release Chukwa 0.8.0,None,Major
bc8436849a5a7f0dc4146055be4977f721fc641f,CHUKWA-808,Bug,Solr startup in docker image should be synchronized,Build and Test Code,Major
750e3190cdebb6b026fd0dcf07702a67c7d1b997,/,/,    Update Change Log for 0.8.0rc0,/,/
d3834147435fa5160014686569d001e74721d940,CHUKWA-807,Bug,Update docker support to use Hadoop 2.7.2  Solr 5.5  and HBase 1.2.1,Build and Test Code,Major
0cce2791af8a7dfe83ae7b6d0f2020a6d1a99420,CHUKWA-806,Improvement,Replace Gridster with GridStack for hicc dashboard,User Interface,Major
6f04f07cd061ff94d212d9b35400d9a036af5d50,CHUKWA-806,Improvement,Replace Gridster with GridStack for hicc dashboard,User Interface,Major
6f6e4399eb10f11814b2d478527d88b6ad351a99,CHUKWA-806,Improvement,Replace Gridster with GridStack for hicc dashboard,User Interface,Major
e0bf3c0efd5a60aef21d86578fa74f961045c505,CHUKWA-805,Improvement,Show examples in HICC REST API document,User Interface,Major
84ade82813f0986fed597c3a5e3ccfe1540fc5de,CHUKWA-804,Task,Update user document on how to start/stop Chukwa processes,Documentation,Major
f77266b555d46969bf3e0985f120312603be105a,CHUKWA-803,Bug,Update SolrWriter to use CloudSolrClient,None,Major
8011ff1f59b4702d1987281fc90b2ca60f2e3a9b,CHUKWA-802,Improvement,Update Javadoc for Java 8,Documentation,Major
8329221c48c9d5846e6792031be7ec148b06fe08,CHUKWA-801,Bug,TestFileTailer fails frequently on Jenkins,None,Major
7bd52b278fa4a4e35ee1a83d24ca9065c5dd67bd,CHUKWA-798,Bug,Implement Retry logic for SolrWriter,Data Collection,Major
7eb11028f2ab146b2598085cf90f5d96809714c8,CHUKWA-798,Bug,Implement Retry logic for SolrWriter,Data Collection,Major
6b2ddcf0c2f94a264edfde2009d928ee5c832852,CHUKWA-799,Bug,Upgrade jsoup version,None,Major
80bd09e9952c27326254bff0da15d9d116ce61df,CHUKWA-800,Bug,Upgrade Hadoop and HBase dependency,Data Collection,Major
21b24284255d15fdc359ada9fc68d3a59fb60f7f,CHUKWA-798,Bug,Implement Retry logic for SolrWriter,Data Collection,Major
fc70665574b7b54de583cd224552f032d8706633,CHUKWA-797,Bug,Improve retries of HBaseWriter,Data Collection,Major
3f5bb3c3cbc4dccc460f5ead2c132a0108576d47,CHUKWA-796,Bug,Shell script still reference to collector,Scripts,Major
326f05987cab95d3d58c5ead461c2c9360ba73d6,CHUKWA-795,Task,Release Chukwa-0.7.0,None,Major
20a6456dd66d3bc782147328ad237c0aecf386fe,CHUKWA-795,Task,Release Chukwa-0.7.0,None,Major
15a2900e2878427b3280fd1a1b7c57e8dd5e644c,CHUKWA-795,Task,Release Chukwa-0.7.0,None,Major
db2e5f8ddb7d6acdbed453a987a8a435fbf4d8f9,CHUKWA-795,Task,Release Chukwa-0.7.0,None,Major
b9fa3b25ac5d81d4b850f7029a92f370e995f945,CHUKWA-734,New Feature,Gora Storage System for Chuckwa Logs,Data Collection,Major
cac335a10c8f9b0ce09cc4dc5bead940e07f78bd,CHUKWA-734,New Feature,Gora Storage System for Chuckwa Logs,Data Collection,Major
83baac244354fe51d25b70110f0f2d3c8202f53a,CHUKWA-791,Bug,Quick links shows page not found in Docker environment,User Interface,Major
d6e09cfac3fa91b5593baf5984de3482f61be758,CHUKWA-790,Improvement,Support Java 1.8,Build and Test Code,Major
f0f60e2ed6647c44f7fafe35741872fef2ea008c,CHUKWA-789,Task,Document new Chukwa HBase schema,None,Major
6e69e543cbb8bac1ca3c4e82f24a28871520269d,CHUKWA-789,Task,Document new Chukwa HBase schema,None,Major
6b70f9e544074bedddb573f3ab4cf45ce0f0eea8,CHUKWA-789,Task,Document new Chukwa HBase schema,None,Major
aa76d992103168e93b7d1b2c1c92d67fad843567,CHUKWA-788,Bug,Ring Chart threshold setting is not stored in hbase,None,Minor
49384fb15850145f728c62c5d7320881c4909450,CHUKWA-787,New Feature,Add full screen and quick links,None,Major
0e518f8d71a3bba3534ab068e6703386e32f4c23,CHUKWA-786,Improvement,Update Chukwa document to match 0.7 release,Documentation,Major
5e66273f6f5960f01eae97d8b719f50e1e394fd1,CHUKWA-785,New Feature,Add new chart type to graph explorer,User Interface,Major
a13bc5ae09af5b60c52b465792d33bd5fc86ad12,CHUKWA-784,Bug,TestBackfillingLoader test case is failing,None,Critical
c440a9f901a9f29b60f10047cb67e0b1cb188f89,CHUKWA-784,Bug,TestBackfillingLoader test case is failing,None,Critical
93a1f75c45f7333dcba2980f5ec9ebbdc64bb9d3,CHUKWA-784,Bug,TestBackfillingLoader test case is failing,None,Critical
a990fc54a555a409b6716e170d9acb92d56bf2c3,CHUKWA-784,Bug,TestBackfillingLoader test case is failing,None,Critical
0d9f40360edff12f0ee25aa461aa8a6063cde5fa,CHUKWA-783,Improvement,Update documentation within the Quickstart to ease publication.,Documentation,Minor
d3fba3fac8c17b1b2a5a835d74fbf57ac073fde6,CHUKWA-780,Bug,Chukwa master branch failing with RAT unapproved licsenses,Build and Test Code,Blocker
978656ad9429803e34e175191e050f5d6dc6ef1f,CHUKWA-781,Bug,Prevent infinite loop of login page,User Interface,Major
6e9e7899daa1e1621e754875260357a6c398859e,CHUKWA-779,Bug,HICC crashes due to incompatible JSP libraries,User Interface,Major
666dbb9c12eb1078c345b4a281f3da629298b425,CHUKWA-778,New Feature,Add ability to generate circle and pie charts,User Interface,Major
602b55f962657f35baab7a0c2f42de8947f6fb4b,CHUKWA-777,New Feature,Add Home page dashboard,User Interface,Major
253797e830c51e5e542d654987f8e54681636bd1,/,/,    Add ability to generate circles graph.,/,/
112d3bbd652dcdb15b40bdcdc9b01398019e6eff,CHUKWA-776,New Feature,Support Docker image,None,Major
a311649089d25a8c8ec33902da2a6c06fd155d29,CHUKWA-773,Improvement,Update maven-surefire-version,Build and Test Code,Trivial
dd10a5cf72bdc9b5e4960ac050761070cc62c913,CHUKWA-775,Bug,Update Jersey dependency,None,Major
14e823343cfac98a34e2502ffa49c3169e2c8a7f,CHUKWA-774,Bug,chukwa-env.sh may not correctly locate CHUKWA_PREFIX,Scripts,Trivial
7f662e8c625b7f14164329ff75ef038456e600ca,CHUKWA-771,Bug,Findbugs flagged coding style issues,None,Major
0961ec169e349beff2c631c785147de581f8599a,CHUKWA-772,New Feature,Implement Parquet writer,Data Collection,Major
6012e14f8d96c98439ab7e71001c9266a467da72,CHUKWA-771,Bug,Findbugs flagged coding style issues,None,Major
e29381f07cb5c122ee43f887c6326e99652548f1,CHUKWA-770,Bug,Improve default dashboard population,User Interface,Major
384d3449ce18694ac58ab77754f18ec87492ae00,CHUKWA-769,Improvement,Update usage of HBase API,None,Major
f3dfc942025d4f476815df85091d35559e13f72a,CHUKWA-767,Improvement,Implement low pass filter for Charting REST API,None,Major
068b454e149842734e4bfc880e8aad97da0877a0,CHUKWA-766,Bug,Update LICENSE.txt and NOTICE.txt and source file headers,None,Major
be0e0cf1d2ac98bc820abded5dc6e353800df8b6,CHUKWA-765,Improvement,Stylesheets clean up,None,Major
c914d3401026c8dbb8b93bba4da52841b704f0f5,CHUKWA-764,Bug,Consolidate usage of JSON libraries,None,Major
01a72e24b816f93f9a9c97312c4f4b62664a1c68,CHUKWA-763,Bug,Remove unused libraries from Chukwa source code,None,Major
2e7c6feb108153e44a46f32e78bc4e1387f4d01b,CHUKWA-760,Bug,Add user friendly error message for missing HBase or Hadoop configuration,None,Major
7770e2257275b150f7a42afd939d552410a4ff67,CHUKWA-762,Bug,Remove staled test cases and fix broken test case,None,Major
df343afef8ce1425b4271717115384a33efd4cf3,CHUKWA-761,Bug,Remove confspell jar file from Chukwa,Data Collection,Major
e1f0df55dcaadb48398bb680fc85c2983f897279,CHUKWA-759,Improvement,Configuration for collect HBase metrics and log files,Data Collection,Major
d8abe979aaa2f107240ea5aeaeca9207eff65332,CHUKWA-758,Bug,Update dashboard default widgets,User Interface,Major
0cad3aae2355b101c6324a9d46a784cbab00090f,CHUKWA-756,Sub-task,Update Chukwa Solr UI integration,Data Collection,Major
88ec3d01180519193f0f85912e404d8816acf6d2,CHUKWA-757,Sub-task,Supply example log4j.properties to stream Hadoop logs to Chukwa,Data Collection,Major
d26630bff21d561832ac62b8c3aad9b528d96b61,CHUKWA-755,Sub-task,Add a reverse proxy to solr,Data Collection,Major
2d20ab592b0db8abcad09f616e803f085dcb407a,CHUKWA-749,New Feature,Redefine Solr facets for Hadoop log monitoring,Data Collection,Major
b2bcd77b08e2392cc7c202ccd2594be7fa7f64d6,CHUKWA-754,Bug,Improve graph explorer performance,User Interface,Major
dfe84a2c3721521a1007d33e8f7daa15ea99aef2,CHUKWA-746,New Feature,Redesign dashboard,User Interface,Major
0f9b5cf3f3956635123f5ab38e29d0e5dce4e6d9,CHUKWA-748,Sub-task,Refactor Series object for charts,User Interface,Major
4134fc32c095e83570bd36ec571b2f1904348149,CHUKWA-747,Sub-task,Update Widget storage to HBase,User Interface,Major
1c4ed7bcc043e6b391ca5a74edb224a6cdabc1cb,CHUKWA-747,Sub-task,Update Widget storage to HBase,User Interface,Major
a6e0cbad7cd52cc04a5363c04bc0fbd5b78f66be,CHUKWA-745,Improvement,Improve charting service metadata management,User Interface,Major
16927ce693554c312197ad60d1db5b7f8f4f6702,CHUKWA-744,Task,Refactor ETL process for HBaseWriter,Data Processors,Major
f9dea324bd532478e81ca4a4fece26ec42119b6f,CHUKWA-744,Task,Refactor ETL process for HBaseWriter,Data Processors,Major
6def7b64d294f13ff2ef50e783d32cd0384c949f,CHUKWA-743,Bug,race condition in PidFile,None,Major
ecf9b2b699a58ad3d5c2efca071fa28b54a92189,CHUKWA-743,Bug,race condition in PidFile,None,Major
7ae68398626b33ac5fc06caf83573e992b766af0,CHUKWA-667,New Feature,Optimize the HBase schema for Ganglia queris,Data Processors,Major
fb022bfd21afbdb8d512bf9d0fb68e85078c8486,CHUKWA-742,Bug,StatusCheckerException.java and README.md don&apos;t have license information,None,Major
f01a8943eac429cf49c8f5545b75ace23cc6b6fd,CHUKWA-741,Improvement,Update to Hadoop 2.6.0 and HBase 1.0.0,Build and Test Code,Major
5ef725a66baae830815b60bda51065bff4ec7b69,CHUKWA-740,Improvement,Update Chukwa README,Documentation,Major
da6868453da5380d71ab3dd834611fb2a2480379,CHUKWA-740,Improvement,Update Chukwa README,Documentation,Major
021c78c794fd848c3c206f59dad62a84bf8bb8e6,CHUKWA-740,Improvement,Update Chukwa README,Documentation,Major
b9f3c0b13827828de7e767662bc70934ce7b6aa3,CHUKWA-739,Improvement,Update XSS filter to use actively maintained API,User Interface,Major
555add1c16110307479dee5ba1ac1850190b56b0,CHUKWA-738,Improvement,Dragging widget over iframe cause mouse event to hang,User Interface,Major
a912d6c66dacf17271c358aa24492b0a4dfe1005,CHUKWA-737,Improvement,Add heartbeat adaptor to push chukwa agent status to remote http server ,Data Collection,Major
9d88538ff48f60a839ae7d24f997af5905e1c835,CHUKWA-736,Improvement,SSL for agent rest api and rest adaptor,Data Collection,Major
e1fd956b9241260624a6f2f3812d2421e0f94300,CHUKWA-735,Improvement,Update Nagios support,Data Processors,Major
a8d8a62ed56cf9d4c46f0c854515dcbfab3a4b91,CHUKWA-723,Improvement,Update Chukwa code to use new HBase API available in 0.94,Data Collection,Minor
49116b0aa22b01d4271e010301172965db5fce58,/,/,    Ant file not really needed,/,/
c63f6a96631d411cb4cf2d9d0c4bd38ac5e80c95,CHUKWA-725,Bug,Solr configuration file prevents rat audit to pass,None,Trivial
6c6a28123bbb6e2cb5d6230f6291b80df8c4ed0a,/,/,    Moved rat excludes to Ant file,/,/
e4a51b7c4d27f178da04edb3394109b7a1da0bdb,/,/,    Empty file not needed,/,/
6e3e73e9af5fed61a3fd6eae24f4886c1899f7dc,CHUKWA-730,Bug,Solr configuration mismatch between solr 4.7.2 and 4.9.0,Data Collection,Major
71bcad35f84ef6a638c91dc655ea7dac33c3fa0f,CHUKWA-729,Bug,Downgade solr version to work with JDK 6,Build and Test Code,Major
b467068312ed9e361cd54f793c606d7c6b8f4d92,CHUKWA-727,Task,Release Chukwa 0.6.0,Build and Test Code,Major
5bcfc0b732bdfcfad14470800ffe5ee78fa991c8,CHUKWA-727,Task,Release Chukwa 0.6.0,Build and Test Code,Major
74f23dad5044947e4f94bc695567d3c81224cad6,CHUKWA-728,Bug,Update start-chukwa.sh to start essential components,Scripts,Major
c43e10c378a2487debdea5b0b9503f577a9dc1fc,CHUKWA-726,Bug,Reduce port binding test from 120 seconds to 10 seconds,None,Trivial
77f97405d973e761eebfc7540aa55e3a47de8349,CHUKWA-725,Bug,Solr configuration file prevents rat audit to pass,None,Trivial
e0aa4c1812ec376f693c1f15762335cddb421fba,CHUKWA-722,New Feature,Integrate Solr with Chukwa,Data Collection,Major
d3f7189f2bf94ff9fb153394c954e9f7ca7be769,CHUKWA-719,Task,Make Chukwa work in Kerberized cluster,None,Major
4e7e7e01d1898b93cfc2dfaa50640db1bcdf2dd8,CHUKWA-715,New Feature,Implement Oozie Adaptor to collect oozie instrumentation info,Data Collection,Major
3ae226a3a937f990087fff1cf9e54344d1de6ead,CHUKWA-713,Improvement,SystemMetrics enhancement,Data Collection,Minor
160b22b99a15f48d7b529905032c9d927df7712b,CHUKWA-712,Task,Rest Adaptor to collect metrics exposed via REST URLs,Data Collection,Major
865596312a26726fe2c74573a17bff36bfa20be6,CHUKWA-721,Bug,Update Chukwa document to match 0.6 release,Documentation,Major
e4b13e4ac3798393869e63cadfd306c2cead2be9,CHUKWA-718,Improvement,Document Chukwa Agent REST API,Documentation,Major
7d3c502c364ac9890ec98033141ecf254253babf,CHUKWA-718,Improvement,Document Chukwa Agent REST API,Documentation,Major
0a2f924aba6c8871cc8a5e72fb05fd7157557172,CHUKWA-716,Bug,Frequent unit test failures org.apache.hadoop.chukwa.inputtools.TestInputFormat.testInputFormatIllegalRegex,None,Major
7a30f2d592f824f2f29a3572905e9aac06e5474d,CHUKWA-716,Bug,Frequent unit test failures org.apache.hadoop.chukwa.inputtools.TestInputFormat.testInputFormatIllegalRegex,None,Major
e8ab727dbfea21070694e374f7ca9fe183db0d50,CHUKWA-714,New Feature,Ability to make memory queue configurable  ,Data Collection,Major
5001f857aee75c92c1cecf469e20c6fe21a787bd,CHUKWA-710,Bug,Need to reuse server sockets,Data Collection,Minor
827af0cebab9a9a729b295502ccf9d1d7c79f591,CHUKWA-710,Bug,Need to reuse server sockets,Data Collection,Minor
2f74fbbfc995f0382d2d300dfa452174cc0e575f,CHUKWA-674,Improvement,Integrate Chukwa collector feature to Chukwa agent,Data Collection,Major
313cca14a3736c45b03a2e18da70d45f58f0e5a6,CHUKWA-705,Bug,Support JDK 7,Build and Test Code,Major
b80cd910c535ff19a2c1bf8e6bf6f9f8f96ec34b,CHUKWA-708,Bug,Update the links for downloading the chukwa code. ,Documentation,Minor
b126d4920d01fc5b494eb0091431db1a51ce281f,CHUKWA-705,Bug,Support JDK 7,Build and Test Code,Major
0793f361cfc852065687c6e355a2a9c76486f94b,CHUKWA-705,Bug,Support JDK 7,Build and Test Code,Major
dd9fc62a54e7a817255c20f6ce4fdff285e00ea1,CHUKWA-710,Bug,Need to reuse server sockets,Data Collection,Minor
03b1d75fd37859407ec16ab116c3d5daaf6dd561,CHUKWA-710,Bug,Need to reuse server sockets,Data Collection,Minor
4b75902d126eb482d8f9713353565c31c260da71,CHUKWA-710,Bug,Need to reuse server sockets,Data Collection,Minor
65b03cd41768b716319a4642ee30279ae030e628,CHUKWA-710,Bug,Need to reuse server sockets,Data Collection,Minor
d1d9476a648df567dfa0bd7b368e81bd583ec0cf,/,/,    Chukwa has become a TLP,/,/
81cac7eefea97b7e7a2c4949ef73f41b74b27999,CHUKWA-699,Bug,Update event viewer stylesheet,User Interface,Major
7ca54fb91930f4a51510c053cdff4773072dfe1b,CHUKWA-698,Bug,Update Rat plugin to recognize MIT license and missing license files,Documentation,Trivial
40b67fce7c1cec4dcc1fa9f0f56a12ef24d8d8ad,CHUKWA-697,Bug,Create a generalized REST API and widget for creating heat map for time series metrics,User Interface,Major
8b6ba133a11d2af0013000c0dd692924fb4aecf0,CHUKWA-696,Bug,Improve hicc stylesheet,User Interface,Major
4095f2de2e1a87704b1f0c2af4bcad044a45347a,CHUKWA-695,New Feature,Add ability to export widgets from graph_explorer,User Interface,Major
ce8f75d4305119e9e938760edd32ba7537f7afb2,CHUKWA-694,Bug,HBaseWriter can not find demux mapper class,Data Collection,Major
bf08fa3c4a2a9c6a6bcab134e6898f0d10405569,CHUKWA-581,Improvement,Demux  do not support user custom reducer package name.,MR Data Processors,Critical
386cd76f11709922dcd10d174a524b549e653217,CHUKWA-693,Bug,Update Hadoop and HBase versions for 0.6.0 release,Build and Test Code,Trivial
9026d77107daedb07a465541d077696c1061efe4,CHUKWA-692,Bug,Race condition in TestExecAdaptor,Data Collection,Major
d2799168b3630c6bd4057bf73036dd8324a81444,CHUKWA-581,Improvement,Demux  do not support user custom reducer package name.,MR Data Processors,Critical
27200b4a2d2076370d499f0a5f87b51b810eb24a,/,/,    Whitespace checking to test permissions,/,/
644c9cfbe5419b067604af808886063e6c405518,CHUKWA-686,Improvement,Creating a new adaptor: FileTailingAdaptorPreserveLines,Data Collection,Minor
7d5c0df04d3c9dfa175c470964c3b2efde9f4d46,CHUKWA-686,Improvement,Creating a new adaptor: FileTailingAdaptorPreserveLines,Data Collection,Minor
e138ae2f97ec43ef722d748148512307f2dee990,CHUKWA-691,Bug,Improve PID handling for service not running.,None,Trivial
0e33e1139b44b1b749baf1b2434d541048537bf8,/,/,    Whitespace checking to see if I have the privs to do so,/,/
fdc92fe56b487ffe4c9d8faf9880f108a0944baf,CHUKWA-565,Bug,HbaseWriter not compatible with TsProcessor,None,Major
87e86df8b1da34887a90f6f8bf04c9fbdc292820,CHUKWA-676,Bug,Too many unapproved license,None,Major
e6ef506c6941c73555695fbe71050eba1c57c1a1,CHUKWA-677,Bug,chukwa script fails to check if the process is already running,Scripts,Major
dac18b1dd563218bf1b6c26acb3e477e0cccc5ba,CHUKWA-676,Bug,Too many unapproved license,None,Major
c333d2d5e27967f3355b1e7742309a4f04896e7d,CHUKWA-669,New Feature,JMX adaptor,Data Collection,Major
cf73656b49f062f9fc01b31599d672bc85532691,CHUKWA-671,New Feature,Json processors for processing JMX data from Hadoop  HBase and Zookeeper,Data Processors,Minor
a26ff89b6463065151ce575a95faaddc72e571b5,CHUKWA-672,Bug,Adaptor not found in checkpoint after shutdown,Data Collection,Major
e5086afb977c4950252653e9a5449b4e5784a616,CHUKWA-675,Bug,Bad sleeping condition in FileTailer.java,Data Collection,Minor
0d1e5c8eff7ae817444339558072af81761c4a41,CHUKWA-642,Bug,Unvalidated Regular Expression Usage,MR Data Processors,Major
b58a0520f368438b9857b12db1fe435f2c06d2d7,CHUKWA-668,Bug,Infinite loop in FileTailingAdaptor,Data Collection,Major
941c7213e9e63c6247960c22eb7380d982fb352f,CHUKWA-664,New Feature,network compression between agent and collector,Data Collection,Trivial
6b1bd0a287b1d9fc30acf183a2c7c88da0633a09,CHUKWA-653,Bug,Pre-compile JSP code in mvn compile phase,Build and Test Code,Major
ed0c27460eb57906f04932d1ae21ddaf4506d59b,CHUKWA-642,Bug,Unvalidated Regular Expression Usage,MR Data Processors,Major
88379bf74b78c93331b1a8f10d610f38c73fd0d9,CHUKWA-632,Bug,Logs getting lost in hbase using TsProcessor,None,Major
837d3118338f27b5b527131d61d74379b7f9fcd6,CHUKWA-655,Bug,host_selector_user.jsp contains redundant source code ,User Interface,Critical
734b8a48a46ae79fa304237aae67ab07478740a2,CHUKWA-662,Bug,Compling errors in event_wrapper.jsp  event2_viewer.jsp files,User Interface,Major
1960cf709c6c18df8ed82f89f0638fcdcb255ef9,CHUKWA-651,Bug,Cannot view hicc index page ,User Interface,Critical
d55104a67f7df6f73133f5542b295126730b1727,CHUKWA-635,New Feature,Collect swap usage,MR Data Processors,Major
b80b08ae7f3cc4a6194d25ace2658546ca2bd6b3,CHUKWA-637,Bug,Initial visit of HICC does not have cluster selection setup properly,User Interface,Major
518c4b5d1fca3bd8988862b6d5bc87ea4c5430e9,CHUKWA-648,New Feature,Make Chukwa Reduce Type to support hierarchy format,Data Processors,Major
ff7754b91407d37ce87a744df2bf6fc93a6e8e4d,CHUKWA-654,Bug,HICC session hosts bug,User Interface,Major
cbf91f9c32ae3c70cde80e21c0c1f5a29a7425f9,CHUKWA-652,Bug,chukwa hicc web descriptor utilization.descriptor json format  parentheses match error,User Interface,Major
a6a4f8c6a2c9015a3e5738f2f9eaf0cf1cbfaa57,CHUKWA-648,New Feature,Make Chukwa Reduce Type to support hierarchy format,Data Processors,Major
34c5bc3567f7cec76d2f551d86a467bfe7d3c30e,CHUKWA-650,Improvement,Re-configure Demux ReduceNumber without re-starting the DemuxManager service,Data Processors,Major
7051d09101dfbfff815b3c92da963da9c4486bbb,CHUKWA-649,Improvement,To handle pid-file missing case while stoping chukwa processes,Scripts,Trivial
e8126396d3deab11187beebdc5ccd159227bb1ee,CHUKWA-647,Improvement,Spread out intermediate data with the same ReduceType into different Reduce Tasks,Data Processors,Minor
7d1290cc59b5631a2b75d3683cf6313a46595333,CHUKWA-646,Bug,FileTailingAdaptor can&apos;t handle the file rotating rightly and the checkpoint size is wrong,Data Collection,Major
78b289209b2f954c841f1c9bd31b16a9a0ae91e6,CHUKWA-645,Improvement,Update dependency to Hadoop 1.0.3 and HBase 0.94.0,Build and Test Code,Major
6c85a174aff630ad83ebd34b027da4e7049c5828,CHUKWA-640,Bug,JVM not terminating if agent is not started,Data Collection,Major
e44f5798117c9c684eabafdfcaaa0ecc2a5df3e5,CHUKWA-643,Bug,Hicc builds with conflicting jar dependencies,None,Major
78d81df53de14c6009dfa147c3fb48c39e806356,CHUKWA-640,Bug,JVM not terminating if agent is not started,Data Collection,Major
fc7cfe2cca0609a77cdb7025b6a06303eac30822,CHUKWA-641,Bug,PatternSyntaxException Crash from Unvalidated Regular Expression Usage,None,Major
7b2c69ec8c95e518d14ae57dbb859727bcd7ed3d,CHUKWA-640,Bug,JVM not terminating if agent is not started,Data Collection,Major
3ed0259c9061962481523adeeaada2315daf60a8,CHUKWA-300,Bug,wiki pages severely out of date,Documentation,Critical
935b7d2ea11a99a9800539928b8200c545985f5c,CHUKWA-638,Bug,Daylight saving time causes TestChukwaWriters unit test to fail,Build and Test Code,Major
50fc2ea7610ca0ebff4a24f0957d90eacffb8bcd,CHUKWA-639,Improvement,Update HBase dependency to 0.92.1,Build and Test Code,Major
e5027faaf3819753763452b83a38edf1b3af82a2,CHUKWA-638,Bug,Daylight saving time causes TestChukwaWriters unit test to fail,Build and Test Code,Major
63efa572ea09af9d313f433db9cdd463c34095ab,CHUKWA-636,Bug,Cannot start hicc successfully,User Interface,Blocker
c4a012d0e7eb323656d6c6fbb4cdf30906c68d83,CHUKWA-630,Improvement,Chukwa&apos;s RPM should create the user &apos;chukwa&apos; before installation,Build and Test Code,Minor
7634c21918e359254e081ab2ed3c3731a17b4b4a,CHUKWA-628,Bug,Update LICENSE.txt and NOTICE.txt and license related items,Documentation,Minor
71a1b0c4893335ca30c6baef3f0eadb26cf3523d,CHUKWA-629,Improvement,Update Hadoop dependency to Hadoop 1.0.0,Build and Test Code,Trivial
f24511c0d8084a3ac2f673253a668d4193cf797a,CHUKWA-628,Bug,Update LICENSE.txt and NOTICE.txt and license related items,Documentation,Minor
c4fd5b29d4b6b2f4f82e9f1f85cd475813dbd6b9,CHUKWA-628,Bug,Update LICENSE.txt and NOTICE.txt and license related items,Documentation,Minor
b17fe9bcf64da3517d5084db6b5e0678ff2045e4,CHUKWA-627,Improvement,Update LICENSE.txt and DISCLAIMER.txt,Documentation,Major
0def2d8a68768b2db5a905c3229a957eb56d02fa,CHUKWA-626,Improvement,Document dependency licenses in NOTICES.txt,Documentation,Major
ff1b75c5e752e7777665232b7b6a69fdda07de73,CHUKWA-624,Improvement,Add md5 signature as part of maven install,Build and Test Code,Trivial
39f9f866835c0f7491764d32641ba71a26881049,CHUKWA-623,Improvement,Add ability to create source tarball for release,Build and Test Code,Major
a9f8fdec8cb7fcd36cceb89505170b213c4ef3ec,CHUKWA-623,Improvement,Add ability to create source tarball for release,Build and Test Code,Major
97937fac0d7a4f477bee52cdb10b4325e945c01f,/,/,    Increased Chukwa trunk version number to 0.6.0.,/,/
08ab66cc53c770ed4d9e500b32aaef331d5b7d9f,CHUKWA-622,Task,Improve documentation to include HDFS instruction for collector,Documentation,Trivial
fbddd8a5d751508bbd669666aef5054784c3e7f2,CHUKWA-621,Bug,Fix warnings found by code analysis tools,User Interface,Major
a183e04f867f0f7fdce0408e8ea5d86907c13353,CHUKWA-620,Improvement,Update code analysis and license check in the build structure,Build and Test Code,Major
688fc62e38fe176e807000a2f2006d03c7b62dd3,CHUKWA-619,Wish,Disable Trace Method on Collector&apos;s Port,Data Collection,Trivial
95849255b8f5fa7b37714b3cc27e83f3b16e4ea0,CHUKWA-618,Improvement,Describe how to create HICC widgets in programming guide,User Interface,Major
c4cd7613ea6ad9af2b87786aee04366bf0bea479,CHUKWA-522,Improvement,Add HICC User guide,Documentation,Major
